sr_no,id,original_language,original_title,popularity,release_date,vote_average,vote_count,genre,overview,revenue,runtime,tagline
1954,204342,ja,HK/変態仮面,32.975,4/13/2013,6.2,106,"['Action', 'Comedy']","High school student Kyosuke Shikijo is the most talented member of the school's martial arts of the fist club. His late father was detective and Kyosuke share his father's strong sense of justice. Kyosuke also has a secret. Kyosuke likes to wear female underwear and transforms himself into the alter ego ""Hentai Kamen,"" wearing female underwear and gaining superhuman powers. This unusual interest also comes from his parents, with his father a masochist and his mother a sadist. By chance, Kyosuke gets the underwear of female high school student Aiko Himeno. With her underwear, he gains various pervert techniques and attempts to protect Aiko from a dirty and heinous teacher.",$0.00,105,Panty Bless You.
1979,362584,ja,傷物語〈Ⅱ熱血篇〉,33.186,8/19/2016,8.1,117,"['Animation', 'Fantasy', 'Mystery']","Koyomi Araragi was turned into a vampire by the legendary vampire, Kiss-shot Acerola-orion Heart-under-blade, and he needs to revive the weakened vampire back to her complete form to return to being human again. The only way for Koyomi to achieve his goal is to fight the three vampire hunters – Dramaturgy, Episode and Guillotinecutter.",$0.00,64,
1984,311056,ja,劇場版 境界の彼方 -I'll Be Here- 過去篇,39.652,3/15/2015,7,41,"['Animation', 'Fantasy', 'Action', 'Drama', 'Comedy']","It all began quite suddenly. Akihito, who appears human but is actually half yomu with the power to quickly heal himself, sees a freshman girl who appears ready to jump from the school rooftop. The girl, Mirai, who has the ability to manipulate blood, which is unique even among members of the spirit world, continues to fight her isolation. Akihito decides at that moment to save Mirai, but disturbing events soon begin to unfold.",$0.00,82,
1991,462677,ja,映画ドラえもん のび太の南極カチコチ大冒険,26.434,3/4/2017,7.5,34,"['Animation', 'Adventure', 'Fantasy', 'Family']","Unable to endure the midsummer heat, Doraemon transports Nobita and his friends to a huge iceberg floating in the South Pacific. While creating an amusement parks with the secret tool ""Ice-working Iron"" the group finds a mysterious golden ring in the ice. Upon closer examination, they determine that the ring was buried in Antarctica 100,000 years ago - before people could have lived there. Doraemon and friends head to Antarctica looking for the owner of the ring and come across the ruins of a huge city buried in the ice. Using Doraemon's Time Belt, the group travels back 100,000 years ago and meets the young girl Kara who is connected to the mysterious ring. But now the group must fight for survival as Doraemon faces the crisis of the entire Earth freezing.",$0.00,101,
2007,378108,ja,この世界の片隅に,36.635,11/12/2016,8.1,410,"['Drama', 'Animation', 'Romance', 'War', 'History']","Japan, 1943, during World War II. Young Suzu leaves her village near Hiroshima to marry and live with her in-laws in Kure, a military harbor. Her creativity to overcome deprivation quickly makes her indispensable at home. Inhabited by an ancestral wisdom, Suzu impregnates the simple gestures of everyday life with poetry and beauty. The many hardships, the loss of loved ones, the frequent air raids of the enemy, nothing alters her enthusiasm…","$19,496,308.00",130,Torn apart by war. Brought together by love.
2026,128,ja,もののけ姫,40.337,7/12/1997,8.4,5907,"['Adventure', 'Fantasy', 'Animation']","Ashitaka, a prince of the disappearing Emishi people, is cursed by a demonized boar god and must journey to the west to find a cure. Along the way, he encounters San, a young human woman fighting to protect the forest, and Lady Eboshi, who is trying to destroy it. Ashitaka must find a way to bring balance to this conflict.","$159,414,369.00",134,The Fate Of The World Rests On The Courage Of One Warrior.
2036,181656,ja,アシュラ,35.496,9/29/2012,7,56,"['Animation', 'Drama', 'History', 'Horror']","Abandoned in the barren wasteland of Kyoto, a savage, enraged orphan does whatever it takes to survive in the wild. When he crosses paths with civilization, he must learn to tame the beast within.",$0.00,76,"Born A Beast, To Be Human"
2042,16859,ja,魔女の宅急便,42.842,7/29/1989,7.8,2802,"['Animation', 'Family', 'Fantasy', 'Adventure']","A young witch, on her mandatory year of independent life, finds fitting into a new community difficult while she supports herself by running an air courier service.","$4,493,017.00",103,"I was feeling blue, but I'm better now."
2045,373879,ja,ONE PIECE 〜アドベンチャー オブ ネブランディア〜,34.89,12/20/2015,7.4,95,"['Action', 'Animation', 'Adventure', 'Comedy', 'Fantasy']","Kōmei devises a plan where Zoro and Sanji take part in an eating contest, and the two eat a strange ""good-for-nothing-only"" mushroom that turns them into good-for-nothing men. The two are then locked in a jail cell. When the rest of the Straw Hat Pirates chase after their imprisoned crew, they land on the island of Nebulandia, which features a mysterious fog made from sea water, and it has the same effects as seastone. The Straw Hat Pirates' arrival on Nebulandia is also a part of Kōmei's plan.",$0.00,106,
2047,374195,ja,劇場版 牙狼〈GARO〉‐DIVINE FLAME‐,35.542,4/1/2016,5.7,9,"['Action', 'Animation']","Leon, who has succeeded the name of Golden Knight ""GARO,"" devotes himself to train a young Makai Knight for the next generation, together with Prince Alfonso of the Valiante Kingdom. Then, they receive an order to exterminate the most beautiful Horror in the world which resides in a neighboring country ""Vazelia."" At the same time, a young Makai Knight for the next generation is kidnapped by an unknown person. Leon desperately follows them, only to find that he is surrounded by his enemies at a dead end. Then, a Makai Knight Dario who was supposed to be missing for some time suddenly appears and rescues him. Under his guidance, Leon is led to the town where he meets up a totally unexpected person.",$0.00,78,
2049,149870,ja,風立ちぬ,34.018,7/20/2013,7.8,2091,"['Family', 'Drama', 'Animation', 'War', 'History', 'Romance']","A lifelong love of flight inspires Japanese aviation engineer Jiro Horikoshi, whose storied career includes the creation of the A-6M World War II fighter plane.","$117,932,401.00",126,We must live.
2055,699570,ja,Boruto: Jump Festa Special,38.028,7/27/2017,5.2,9,['Animation'],"Team Konohamaru is given a mission to track down a suspicious person in the village. Meanwhile, before training with Shikadai and Inojin, Chocho tries to find potato chips when they seem to be sold out in every store.",$0.00,12,
2056,10515,ja,天空の城ラピュタ,36.846,8/2/1986,8,2966,"['Adventure', 'Fantasy', 'Animation', 'Action', 'Family', 'Romance']",A young boy and a girl with a magic crystal must race against pirates and foreign agents in a search for a legendary floating castle.,"$5,228,752.00",125,"One day, a girl came down from the sky…"
2072,401043,ja,劇場版「黒子のバスケ」ウインターカップ総集編～影と光～,39.717,9/3/2016,6.8,8,['Animation'],First of three compilation films of Kuroko no Basket.,$0.00,90,
2079,28874,ja,サマーウォーズ,38.454,8/1/2009,7.5,672,['Animation'],"Kenji is your typical teenage misfit. He’s good at math, bad with girls, and spends most of his time hanging out in the all-powerful online community known as OZ. His second life is the only life he has — until the girl of his dreams, Natsuki, hijacks him for a starring role as a fake fiancé at her family reunion. Things only get stranger from there. A late-night email containing a cryptic mathematic riddle leads to the unleashing of a rogue AI intent on using the virtual world of OZ to destroy the real world. As Armageddon looms on the horizon, Kenji and his new “family” set aside their differences and band together to save the worlds they inhabit in this “near-perfect blend of social satire and science fiction.”","$18,434,328.00",114,
2081,38594,ja,ドラゴンボール オッス!帰ってきた孫悟空と仲間たち!!,37.4,9/21/2008,6.4,151,"['Animation', 'Action', 'Adventure', 'Science Fiction']","A 35-minute Dragon Ball animated short film that premiered at the Jump Super Anime Tour in September 2008. It is the first animated Dragon Ball feature in twelve years, following the tenth anniversary film The Path to Power.",$0.00,35,
2086,257475,ja,たまこラブストーリー,32.762,4/26/2014,6.9,94,"['Romance', 'Animation', 'Comedy']","Devoted to her family’s rice-cake–making business and the high school baton club, Tamako is a little slow when it comes to love. She’s oblivious to her childhood friend Mochizo’s affections, even though all their friends know. With graduation closing in and Mochizo leaving for Tokyo, will Tamako realise her feelings and tell him in time?",$0.00,83,"The end of school, the beginning of love…"
2098,741434,ja,ホムンクルス,39.785,4/2/2021,6.2,51,"['Drama', 'Thriller']","A homeless man meets a medical school student who pays him to volunteer for a surgical procedure known as trepanation, drilling a hole in his skull, which ends up giving him the ability to communicate with the dark side of people’s subconscious minds.",$0.00,119,
2111,160642,ja,映画ドラえもん のび太と奇跡の島 ～アニマル アドベンチャー～,27.047,3/3/2012,7.1,38,"['Family', 'Animation', 'Adventure']","Nobita and Doraemon use time tree Mochi and catches a big bird Moa, which has been extinct for 500 years ago. To protect extinct the animal, Nobita and Doramon go to Beremon Island which is protected by a golden beetle named Herakles. They meet a girl from the Rokkoro tribe and a boy who looks exactly like Nobita on Beremon Island ...",$0.00,100,
2137,150023,ja,うる星やつら オンリー・ユー,29.927,2/11/1983,6.3,19,"['Animation', 'Romance', 'Science Fiction', 'Comedy']","Six-year-old Ataru steps on Elle's shadow during an impromptu game of shadow-tag; in Elle's culture, this is viewed as a marriage proposal. Eleven years later, Elle returns to Earth in order to marry Ataru — by which time not only had he forgotten the events of his childhood, but he was also going out with Lum. The rest of the plot focuses on Lum's attempts to prevent the marriage.  The film was directed by Mamoru Oshii who was mad at the many requests that the producer made of him to alter the movie. Rumiko Takahashi considers this film her favorite and it is the most true to the original series.",$0.00,101,
2139,283984,ja,劇場版「Fate/stay night [Heaven’s Feel]」Ⅰ.presage flower,33.113,10/14/2017,7.5,129,"['Action', 'Animation', 'Drama', 'Fantasy', 'Romance']","Shiro Emiya is a young magus who attends Homurahara Academy in Fuyuki City. One day after cleaning the Archery Dojo in his school, he catches a glimpse of a fight between superhuman beings, and he gets involved in the Holy Grail War, a ritual where magi called Masters fight each other with their Servants to win the Holy Grail. Shiro joins the battle to stop an evildoer from winning the Grail and to save innocent people, but everything goes wrong when a mysterious ""Shadow"" begins to indiscriminately kill people in Fuyuki...","$17,422,935.00",120,
2151,810693,ja,劇場版 呪術廻戦 0,39.505,12/24/2021,0,0,"['Animation', 'Action', 'Adventure', 'Mystery']","Yuta Okkotsu is a nervous high school student who is suffering from a serious problem—his childhood friend Rika has turned into a curse and won't leave him alone. Since Rika is no ordinary curse, his plight is noticed by Satoru Gojo, a teacher at Jujutsu High, a school where fledgling exorcists learn how to combat curses. Gojo convinces Yuta to enroll, but can he learn enough in time to confront the curse that haunts him?",$0.00,0,"The origin of ""Jujutsu Kaisen"" – A story of love and curse"
2159,39324,ja,ドラゴンボールZ・絶望への反抗!!残された超戦士・悟飯とトランクス,32.312,2/24/1993,7.5,378,"['Animation', 'Action', 'Science Fiction']",It has been thirteen years since the Androids began their killing rampage and Son Gohan is the only person fighting back. He takes Bulma's son Trunks as a student and even gives his own life to save Trunks's. Now Trunks must figure out a way to change this apocalyptic future,$0.00,48,
2165,447185,ja,斉木楠雄のΨ難,30.835,10/21/2017,6.2,18,['Comedy'],"To the average person, psychic abilities might seem a blessing; for Kusuo Saiki, however, this couldn't be further from the truth. Gifted with a wide assortment of supernatural abilities ranging from telepathy to x-ray vision, he finds this so-called blessing to be nothing but a curse. As all the inconveniences his powers cause constantly pile up, all Kusuo aims for is an ordinary, hassle-free life—a life where ignorance is bliss. Unfortunately, the life of a psychic is far from quiet. Though Kusuo tries to stay out of the spotlight by keeping his powers a secret from his classmates, he ends up inadvertently attracting the attention of many odd characters, such as the empty-headed Riki Nendō and the delusional Shun Kaidō. Forced to deal with the craziness of the people around him, Kusuo comes to learn that the ordinary life he has been striving for is a lot more difficult to achieve than expected.",$0.00,97,
2166,214553,ja,小鳥遊六花・改 ～劇場版 中二病でも恋がしたい!～,38.379,9/14/2013,7,53,"['Comedy', 'Animation', 'Drama', 'Romance']","Summary of the first season of the show, as seen from Rikka's perspective with new elements.",$0.00,97,
2173,283727,ja,アオハライド,32.125,12/13/2014,6.7,45,"['Romance', 'Drama']","When she was a middle school student, Futaba Yoshioka liked Kou Tanaka who was unlike the other boys and quite gentle. Kou Tanaka then moved away and they lost contact.  At the end of Futaba Yoshioka's first year as a high school student she meets Kou Tanaka again. Kou Tanaka’s name has changed to Kou Mabuchi and his personality seems different from his middle school days.",$0.00,122,
2178,110420,ja,おおかみこどもの雨と雪,36.517,7/21/2012,8.3,1648,"['Animation', 'Drama', 'Family', 'Fantasy']","After her werewolf lover unexpectedly dies in an accident, a woman must find a way to raise the son and daughter that she had with him. However, their inheritance of their father's traits prove to be a challenge for her.","$55,060,661.00",117,Love wildly
2180,698940,ja,Naruto x UT,31.531,1/1/2011,7.9,9,['Animation'],"Naruto x UT is the eighth Naruto OVA. Approximately 200,000 copies of this OVA were distributed by Uniqlo to promote a line of Naruto-themed shirts designed by Masashi Kishimoto in conjunction with Studio Pierrot. It shows the aftermath between a fight between Naruto and Sasuke and shows clips of their times together and the story so far.",$0.00,6,
2209,342588,ja,屍者の帝国,38.378,10/2/2015,6.1,64,"['Animation', 'Mystery', 'Horror', 'Science Fiction']","The story of The Empire of Corpses takes place in 19th century Europe, and revolves around John Watson. He is scouted by the government to become a secret agent- However, Watson lives in a world where ""Frankensteins""- human corpses that are re-purposed with a false soul in order to use them as laborers- are used to improve industrial development.",$0.00,120,The dead will inherit the Earth
2215,137227,ja,映画ドラえもん 新・のび太と鉄人兵団 ～はばたけ 天使たち～,29.62,3/5/2011,7.8,31,"['Animation', 'Adventure', 'Family']","The title character, Nobita, is upset because he cannot get a large RC toy to show off to a rich boy, Suneo. His fit makes Doraemon angry, and with the hot Japanese summer, he decides to ""cool off"" at the North Pole with the Anywhere Door, a mysterious portal.  Nobita follows him there after he's gone for a long time, and discovers a strange bowling ball-like orb which starts blinking with a pulsating light, and summons what looks like a giant robot´s foot. After sledding down the hill on it and having it crash into his room through the Anywhere Door, the bowling ball follows him home through the door and another robot piece falls into his backyard.",$0.00,108,
2223,412383,ja,劇場版 艦これ,29.07,11/26/2016,4.8,13,"['Action', 'Animation', 'Science Fiction', 'TV Movie', 'War']","The movie starts off after the events of Episode 3, when Kisaragi had sunk. The Mikawa Fleet (Furutaka, Aoba, Kako, Kinugasa and Tenryuu) are in the middle of Night Battle. Choukai uses Searchlight and gets medium damage, but they win in the end. A New Fleet Girl gets ""dropped"", emerging from the sea. It is Kisaragi. Kisaragi is brought back to the temporary base in Solomon Islands, but she is suffering from PTSD and has amnesia, unable to remember anyone from back in the anime, excluding Mutsuki...",$0.00,93,
2243,198375,ja,言の葉の庭,35.138,5/31/2013,7.6,1445,"['Animation', 'Drama', 'Romance']","Takao, who is training to become a shoemaker, skipped school and is sketching shoes in a Japanese-style garden. He meets a mysterious woman, Yukino, who is older than him. Then, without arranging the times, the two start to see each other again and again, but only on rainy days. They deepen their relationship and open up to each other. But the end of the rainy season soon approaches...",$0.00,46,Lost in life. Found in love.
2247,433950,ja,ひるなかの流星,30.162,3/24/2017,7.8,51,['Romance'],"Fifteen-year-old country girl Suzume Yosano has to move to Tokyo to live with her uncle due to her father's transfer. She bumps into a mysterious man who ends up taking her to her uncle's place after she gets lost. Turns out, Suzume will be seeing him a lot more often once she starts school because... he's her homeroom teacher?!",$0.00,119,
2270,162092,ja,映画ドラえもん のび太と翼の勇者たち,21.997,3/10/2001,7.3,22,"['Family', 'Animation', 'Adventure']","After watching a televised showing about supposedly humanoid birds spotted in Africa, Nobita dreams of being able to fly with wings. He builds wooden wings after Doraemon refuses to help him, though he repeatedly fails to fly using them. While helping Shizuka to reclaim her pet canary, they witness a portal opens in the sky and a humanoid bird riding an airplane coming out. He introduces himself as Gusuke, a humanoid bird who lives in ""Birdopia"". Doraemon, Nobita, and Shizuka help Gusuke fix his airplane, where Nobita becomes fast friends with him. As Gusuke departs to his home, Gian and Suneo catch him and grab his plane. The other three follow them through the porta",$0.00,91,
2310,460399,ja,映画 中二病でも恋がしたい! -Take On Me-,33.268,1/6/2018,7.8,58,"['Animation', 'Comedy', 'Fantasy']","Yuuta and Rikka are in their third year of high school. One day in Spring, Touka declares that she will take Rikka to Italy with her, as her job has stabilized there and thinks they should migrate together as a family. Touka is also worried about Rikka not being competent enough to advance to universities in Japan. The gangs from the club suggested Yuuta, who doesn't want to be separated, to elope with Rikka!! A runaway drama throughout Japan begins.","$1,822,043.00",94,
2353,73245,ja,劇場版 BLEACH 地獄篇,29.714,12/4/2010,7.3,110,"['Action', 'Animation', 'Fantasy', 'Adventure']","Hell – A place where beings that have committed mortal sins during their lifetime are sent. It is a realm where even Soul Reapers are forbidden to interfere. When a group of vicious Sinners plot to escape from this eternal prison, they discover that Substitute Soul Reaper Ichigo Kurosaki is the key to their freedom.","$8,749,681.00",94,
2356,698916,ja,"サニー・サイド・バトル!!!, Sanī Saido Batoru!!!",35.043,9/11/2014,7.3,3,"['Action', 'Animation', 'Comedy']",Sunny Side Battle! (Sani Saido Batoru!) is an OVA that was released with Naruto Shippuden: Ultimate Ninja Storm Revolution. It features Itachi making breakfast for Sasuke in their old home.,$0.00,11,Naruto Shippuden
2373,549787,ja,東京喰種 トーキョーグール【S】,33.19,7/19/2019,6.9,50,"['Action', 'Horror', 'Science Fiction', 'Fantasy']","Now a member of Anteiku, Ken Kaneki grows closer to the ghouls around him. Determined to protect his new home against anti-ghoul forces, he trains his powers in secret. But when the infamous gourmet, Shū Tsukiyama, wishes to savour some half-ghoul flavour, Kaneki's training is put to test of a lifetime.",$0.00,97,To eat or to be eaten
2382,38142,ja,秒速5センチメートル,34.901,3/3/2007,7.3,1394,"['Animation', 'Drama', 'Romance']","Three moments in Takaki's life: his relationship with Akari and their forced separation; his friendship with Kanae, who is secretly in love with him; the demands and disappointments of adulthood, an unhappy life in a cold city.",$0.00,63,At what speed must I live to see you again?
2418,192577,ja,キャプテンハーロック,30.093,9/7/2013,6.6,842,"['Animation', 'Science Fiction']",Space Pirate Captain Harlock and his fearless crew face off against the space invaders who seek to conquer the planet Earth.,"$18,010,317.00",115,
2471,699174,ja,NARUTO ナルティメットヒーロー3 ついに激突! 上忍VS下忍!! 無差別大乱戦大会開催!!,31.759,12/22/2005,4.5,8,"['Animation', 'Action']","A contest is made by the Fifth Hokage called Jonin vs Genin. The point is to collect crystals for points, with the higher-ranked Chunin and Jonin holding crystals worth more points. The Genin have blue crystals, while the Chunin and Jonin have red crystals.",$0.00,26,
2506,40700,ja,僕の初恋をキミに捧ぐ,30.056,10/24/2009,7.4,78,"['Drama', 'Comedy', 'Romance']","As a child Takuma is diagnosed with a heart condition that requires care from a cardiologist. He soon becomes friends with his doctors young daughter Mayu while being treated at the hospital. One day Mayu overhears her father saying that Takumas condition is serious enough that he most likely wont live beyond the age of 20. Takuma isn't aware of this himself, however, so at 8-years-old he makes a promise to marry Mayu when they turn 20. Later in life, Takuma becomes aware that he wont be able to keep this promise and he begins distancing himself from Mayu in hopes of protecting her.",$0.00,122,
2538,28609,ja,ドラゴンボールＺ オラの悟飯をかえせッ!!,32.67,7/15/1989,6.6,386,"['Animation', 'Action', 'Fantasy']","In order to wish for immortality and avenge his father, Garlic Jr. collects the dragon balls, kidnapping Goku's son Gohan in the process. Goku, Kami, Piccolo, and Krillin unite to rescue Gohan and save the world from being sucked into a dead zone.",$0.00,41,
2541,120475,ja,ドラゴンボール エピソード オブ バーダック,38.019,12/17/2011,6.8,291,"['Action', 'Animation', 'Science Fiction']","A spin-off scenario taking place after the events of the TV special Dragon Ball Z: Bardock - The Father of Goku, in which Bardock survives the destruction of Planet Vegeta and is sent into the past, combating Frieza's ancestor Chilled and turning into a Super Saiyan.",$0.00,20,
2547,699254,ja,Naruto Shippuden: OVA Hashirama Senju vs Madara Uchiha,33.153,2/23/2012,6.4,8,['Animation'],Naruto Shippūden Ultimate Ninja Storm Generations OVA Madara vs Hashirama is the tenth Naruto OVA. It is distributed as part of Naruto Shippūden: Ultimate Ninja Storm Generations.,$0.00,10,
2552,553600,ja,プロメア,30.175,5/24/2019,7.3,152,"['Animation', 'Action', 'Science Fiction']","Galo and the Burning Rescue Fire Department face off against BURNISH, a group of mutants who are able to control and wield flames, and the fire disaster they have unleashed on Earth.",$0.00,111,The world ablaze.
2567,17101,ja,劇場版 BLEACH The DiamondDust Rebellion もう一つの氷輪丸,26.134,12/22/2007,6.5,113,"['Action', 'Adventure', 'Animation']","When an artifact known as the ""King's Seal"" is stolen during transport from Soul Society, Hitsugaya Toushirou is assigned to retrieve it. Toushirou goes missing after a battle with the thieves, leading Seireitei to suspect him of treachery. They order his immediate capture and execution. Unwilling to believe him capable of such a crime, Ichigo, Rangiku, Rukia, and Renji set out to find Toushirou.",$0.00,95,
2588,74135,ja,Gantz: Perfect Answer,21.362,4/23/2011,6.7,148,"['Action', 'Mystery', 'Science Fiction', 'Horror']","Perfect Answer begins several months after the events of the first film. Kurono is still fighting aliens under the order of Gantz, a mysterious giant black orb, and he is close to reaching the score he needs to resurrect his friend Kato. Outside his night time missions, Kurono continues to live his normal life, spending time with his new girlfriend Tae. Meanwhile, young pop star Eriko  is being secretly ordered by Gantz to carry out assassinations, and cop Shigeta inches closer towards finding out the truth about the Gantz missions. As the missions begin to get increasingly dangerous for both the alien fighters and the general public, Kurono discovers that the endgame for Gantz is quickly approaching.",$0.00,141,
2598,20329,ja,L change the WorLd,28.852,2/9/2008,5.9,189,"['Fantasy', 'Action', 'Thriller', 'Science Fiction', 'Mystery']","""The human whose name is written in the Death Note shall die."" After making the hardest decision ever, another serious case confronts L. There are only 23 days left and without his best partner Watari (Shunji Fujimura), L has to solve the case all by himself for the very first time.","$30,231,200.00",129,The final death note showdown!
