sr_no,id,original_language,original_title,popularity,release_date,vote_average,vote_count,genre,overview,revenue,runtime,tagline
6240,470639,ja,僕は妹に恋をする,14.008,5/18/2005,5.7,9,"['Romance', 'Animation', 'Drama']","Yori and his twin sister Iku used to be very close as children but lately Yori has grown colder toward Iku and is always eager to stay away from her. Iku was confused by Yori's attitude. Actually Yori is in love with Iku and that forbidden love is causing Yori sleepless nights since Yori and Iku are sharing the same room with bunk beds. Yori tried to ease his intense desire for Iku by bedding Iku's best friend. He had even applied to attend a boarding school in another city to take him far away from Iku. Yori lost his resolve to stay quiet about his feelings when Iku started to talk about having a boyfriend and going on dates. Now Yori want to have his little sister and he confessed. Iku loves her big brother and wanted them to stay together, so Iku is willing to anything to keep them together. But Yori wanted to have Iku as a lover, not as a sister loyal to her twin.",$0.00,50,
6304,11838,ja,呪怨,13.966,10/18/2002,6.8,533,['Horror'],"Volunteer home-care worker Rika is assigned to visit a family, she is cursed and chased by two revengeful fiends: Kayako, a woman brutally murdered by her husband and her son Toshio. Each person that lives in or visits the haunted house is murdered or disappears.","$325,680.00",92,When a grudge from the dead passes to the living - Who is safe?
6319,662638,ja,名探偵コナン 緋色の弾丸,15.162,4/16/2021,7.1,17,"['Animation', 'Action', 'Crime', 'Romance', 'Thriller', 'Mystery']","At the opening ceremony of the WSG (World Sports Games) Tokyo Games, a sports festival held once every four years, it is announced that the world's first vacuum superconducting maglev with a maximum speed of 1,000 kilometers per hour will open. While attracting attention from around the world, top executives of large companies are kidnapped from the party venue where WSG tournament sponsors gather. Conan moves toward a solution and eventually finds a connection with the WSG abduction case that occurred 15 years ago in Boston, USA.",$0.00,0,
6324,462387,ja,ONE PIECE 3D 激走! トラップコースター,11.235,12/1/2011,8.2,9,"['Adventure', 'Animation']","Luffy continues his voyage with the Straw Hat Pirates in hopes of becoming the Pirate King. That is until he crosses paths with one of the Marine’s most intelligent captains, Captain Trap. Determined to capture Luffy, the captain attacks the Thousand Sunny with various traps he created. His intention is to make Luffy his right hand man.",$0.00,12,
6325,36218,ja,劇場版ポケットモンスター アドバンスジェネレーション 七夜の願い星 ジラーチ,13.711,7/19/2003,6.5,192,"['Family', 'Action', 'Animation', 'Adventure', 'Fantasy', 'Science Fiction']","Ash, May, Brock, and Max come upon the festival of the Wishing Star of Seven Nights. During their enjoyment, the legendary Pokemon--Jirachi, descends from the heavens and befriends Max. Jirachi, with the power to grant any wish, is sought after by many people wanting to claim its power. One man seeks to use its legendary power to revive an ancient Pokemon known as Groudon, unaware of the dangers hidden within Jirachi's powers","$334,000,000.00",81,
6346,15080,ja,おもひでぽろぽろ,13.203,7/20/1991,7.3,711,"['Animation', 'Drama', 'Romance']","It’s 1982, and Taeko is 27 years old, unmarried, and has lived her whole life in Tokyo. She decides to visit her family in the countryside, where she begins to reconnect to forgotten longings. In lyrical switches between the present and the past, Taeko contemplates the arc of her life, and wonders if she has been true to the dreams of her childhood self.","$473,110.00",118,I’m going on a trip with Me
6355,331061,ja,劇場版 デート・ア・ライブ 万由里ジャッジメント,17.609,8/22/2015,7.8,30,"['Animation', 'Romance', 'Science Fiction']",The movie adaptation announced at the end of the final episode of Date A Live II.,$0.00,72,
6364,316873,ja,名探偵コナン 業火の向日葵,15.745,4/18/2015,6.2,68,"['Crime', 'Animation', 'Adventure', 'Mystery']","Conan tries to track down Kaito Kid, who supposedly steals a replica of one of Van Gogh's Sunflowers paintings during an auction.","$43,000,000.00",112,
6372,492719,ja,GODZILLA 決戦機動増殖都市,16.46,5/18/2018,6.6,233,"['Animation', 'Science Fiction']","Humanity's desperate battle to reclaim the Earth from Godzilla continues. The key to defeating the King of the Monsters may be Mechagodzilla, a robotic weapon thought to have been lost nearly 20,000 years ago.",$0.00,105,"The last hope of mankind Mechagodzilla, is activated."
6374,13980,ja,ストレンヂア -無皇刃譚-,14.448,9/29/2007,7.6,256,"['Action', 'Animation', 'History']","Pursued by formidable Chinese assassins, young Kotaro and his dog run into No Name, a mysterious stranger who gets pulled into the chase. The unlikely companions form a bond over saving the dog from a poison attack, but chaos erupts when the assassins find Kotaro, and No Name must face his past before a horrible fate is met again.",$0.00,103,
6385,37100,ja,劇場版　美少女戦士セーラームーンＲ,14.421,12/5/1993,8,91,"['Animation', 'Romance', 'Action', 'Fantasy']","While enjoying the flower gardens, Sailor Moon (Usagi) and friends encounter an old childhood friend of Mamoru's: an alien! He's come back to give Mamoru a special flower, but doesn't like Usagi and the rest of the planet's inhabitants. Sailor Moon must defend the earth from the evil Kisenian Flower he's brought back... before the evil vines and blossoms overrun the planet!","$12,307,555.00",61,The Future Depends On Scout Power!
6397,271709,ja,新劇場版 頭文字D Legend1 -覚醒-,19.045,8/24/2014,8.6,45,"['Animation', 'Action']","The first movie in a trilogy, focusing on the battle against the Takahashi brothers. High school student Takumi Fujiwara works as a gas station attendant during the day and a delivery boy for his father's tofu shop during late nights. Little does he know that his precise driving skills and his father's modified Toyota Sprinter AE86 Trueno make him the best amateur road racer on Mt. Akina's highway. Because of this, racing groups from all over the Gunma prefecture issue challenges to Takumi to see if he really has what it takes to be a road legend.",$0.00,62,"In 2014, a new legend starts running"
6400,166268,ja,トリコ3D 開幕!グルメアドベンチャー!!,16.592,3/19/2011,5.6,5,"['Animation', 'Action', 'Adventure']","Teran Plains' village was attacked by a giant starving Gerold, and the village's youngster, Peck, sought Toriko for help. But lying ahead in wait is something much more ferocious and hideous than just a Gerold.",$0.00,40,
6418,438553,ja,ハルチカ,11.524,3/4/2017,6.3,11,"['Drama', 'Music', 'Romance']","Haruta is handsome and smart, Chika is bright and naive. When they were children, they were friends until Haruta's family moved away while he was in the 3rd grade. They meet again during a high school entrance ceremony. After all of these years, Chika is eager to join the wind instrument club. Due to an incident, the wind instrument club is about to be disbanded. Chika can't give up the flute so she attracts Haruta to her side and tries to recruit members from the wind instrument club. The group attempts to solve various cases taking place at their school while they plan to take part in a contest.",$0.00,118,
6419,513367,ja,透明変態人間,10.189,12/4/2013,0,0,[],"Hideo rescues a Chinese guy being picked on by punks on the street, and the guy gives him a small bottle in gratitude, which contained a magical formula that makes one’s body transparent for only 3 minutes. As soon as he becomes transparent, Hideo goes to see a naked Maria, his fellow part-time worker. While he enjoys the life of an invisible man, another invisible man mysteriously appears to seduce her. To keep her from this stranger, Hideo goes for his once-a-lifetime challenge. A furious battle between two invisible men begins!",$0.00,74,
6421,5879,ja,愛のコリーダ,17.184,5/15/1976,6.5,388,"['Drama', 'Romance']","A passionate telling of the story of Sada Abe, a woman whose affair with her master led to an obsessive and ultimately destructive sexual relationship.",$0.00,105,
6423,1680,ja,キングコング対ゴジラ,12.434,8/11/1962,6.7,207,"['Action', 'Adventure', 'Science Fiction']","Japanese-Release Version. Tako, advertising director of Pacific Pharmaceuticals, is frustrated with the low ratings of their sponsored TV program and seeks a more sensationalist approach. He orders his staff off to Faro Island, capturing King Kong to exploit for marketing. As Godzilla re-emerges, a media frenzy generates with Tako looking to capitalize off of the ultimate wrestling match.","$12,550,000.00",97,"Will you win, Godzilla? Will you win, Kong? The battle of the century!"
6425,375509,ja,コープスパーティー,12.37,8/1/2015,5.2,31,"['Horror', 'Mystery', 'Science Fiction']","Facing goodbyes and graduation, Naomi Nakashima, her childhood friend Satoshi Mochida, and their classmates, are clearing up after their last ever cultural festival, when horror buff class representative Ayumi Shinozaki decides to perform Sachiko Ever After so they will stay friends forever. Instead, they were whisked away to a haunted graduation ceremony for Heavenly Host Elementary School, forced to close after a series of gruesome murders. What fate awaits Naomi and her friends at the cursed school...?",$0.00,93,
6502,273653,ja,ドラゴンボール 悟空の交通安全,13.837,6/1/1988,6.6,31,['Animation'],"An educational film featuring characters from ""Dragon Ball"". Roshi and Krillin are on their way to Bulma's birthday party, and they see a boy run into the street, nearly getting run over. Launch, as a traffic officer, teaches him about traffic safety. Meanwhile, Goku, who is also on his way to Bulma's party, gets a traffic lesson of his own from Suno after running through traffic to see her.",$0.00,15,
6507,38582,ja,ゴジラ対メカゴジラ,11.156,3/20/1974,7.1,155,"['Action', 'Science Fiction']","An Okinawan prophecy that foretells the destruction of the Earth is seeming fulfilled when Godzilla emerges to return to his destructive roots. But not all is what it seems after Godzilla breaks his ally Anguirus's jaw. Matters are further complicated when a second Godzilla emerges, revealing the doppelgänger as a mechanical weapon.","$1,330,000.00",84,"Flying through space and firing missiles! A dreadful Godzilla, whose whole body is a weapon, appears!"
6509,257512,ja,名探偵コナン 異次元の狙撃手,15.861,4/19/2014,7,65,"['Action', 'Animation', 'Drama', 'Mystery']","A vicious sniper has appeared in Tokyo, rendering the people too scared to go outside, once again it's up to Conan to figure out the meaning behind the killings and capture the mysterious sniper before more lives are lost.",$0.00,110,
6543,579741,ja,サイダーのように言葉が湧き上がる,13.072,11/3/2020,7.4,96,"['Animation', 'Romance', 'Music', 'Drama']","After meeting one bright, sunny day, a shy boy who expresses himself through haiku and a bubbly but self-conscious girl share a brief, magical summer.",$0.00,87,
6590,14282,ja,獣兵衛忍風帖,13.827,6/5/1993,7.8,396,"['Fantasy', 'Adventure', 'Animation']","Jubei is a masterless ninja who travels the land alone, lending his services to those with gold—or a worthy cause. His fearsome abilities have served him well, but a plot to overthrow the government threatens to end his wandering ways—and possibly his life.",$0.00,94,"Feudal Japan—a time of danger, intrigue and deception . . ."
6600,545143,ja,響 -HIBIKI-,14.308,9/14/2018,7,14,"['Action', 'Comedy']",A high school girl with overwhelming literary talent shakes up the lives of those around her with her brilliant spontaneity.,$0.00,106,
6662,380770,ja,剧场版 薄樱鬼 第2章 士魂苍穹,8.819,3/8/2014,7.1,7,"['Action', 'Animation', 'Drama', 'History']",The second part of the retelling of the first and second seasons of the anime.,$0.00,87,
6664,303903,ja,ポケモン・ザ・ムービーXY 破壊の繭とディアンシー,17.359,7/19/2014,6.4,118,"['Animation', 'Family', 'Adventure', 'Action', 'Comedy', 'Drama']","In the underground Diamond Domain, where many Carbink live, the Mythical Pokémon Diancie serves as ruler. The Heart Diamond that sustains the land is beginning to fall apart, and Diancie is not yet strong enough to create a new one. While seeking help from the Legendary Pokémon Xerneas, Diancie encounters a group of thieves who want to take control of its diamond-producing power–and who awaken the Legendary Pokémon Yveltal from its cocoon in the process! Can Ash and his friends help Diancie discover its true power, stop Yveltal’s rampage, and save the Diamond Domain?",$0.00,76,"When Destruction Rises, Can Life Prevail?"
6673,4977,ja,パプリカ,12.602,10/1/2006,7.8,1516,"['Animation', 'Drama', 'Mystery', 'Science Fiction', 'Thriller', 'Fantasy']","When a machine that allows therapists to enter their patient's dreams is stolen, all hell breaks loose. Only a young female therapist can stop it: Paprika.","$944,915.00",90,This is your brain on anime
6677,85398,ja,千夜一夜物語,13.251,6/14/1969,6.8,30,"['Animation', 'Drama', 'Fantasy']","Beautifully constructed, 1001 Nights stays true to the lush and mysterious backdrop of the well known and age old story. Tezuka remolds the story into an escapist fantasy where a 60s-era working man is transported back to an era of entirely fictitious Arabian details. Seemingly at odds with itself, 1001 Nights consistently unfolds in a way that combines Playboy graphics, Arabian rug design and traditional Japanese scroll paintings.  Sound like a strange mix? You bet and along the way we experience some of the great cultural juxtapositions that makes Tezuka the unpredictable style it is.  Source: MAL",$0.00,128,
6707,36092,ja,いま、会いにゆきます,10.613,10/30/2004,7.7,59,"['Drama', 'Fantasy', 'Romance']","When two souls find one another, nothing can tear them apart. Widower Takumi lives a quiet life with his six-year-old son Yuji after the loss of wife and mother Mio. Yuji unfailingly remembers her promise to him: ""I'll be with you again in a year's time, when the rains come."" On the first anniversary of her passing, Takumi and Yuji are taking a walk in the woods when they come across a woman sheltering from a monsoon downpour.",$0.00,119,
6737,404785,ja,植物図鑑 運命の恋、ひろいました,12.561,6/4/2016,6.9,24,['Romance'],"Sayaka (Mitsuki Takahata) works at a office. She's not very good at her job or with love. One night, she finds a man, Itsuki (Takanori Iwata), collapsed in front of her home. She takes him inside and they begin to live together. Itsuki teaches Sayaka about cooking wild herbs and collecting wild herbs, but he has a secret.",$0.00,112,
6752,150024,ja,うる星やつら3 リメンバー・マイ・ラヴ,12.569,9/4/1985,4.8,8,"['Science Fiction', 'Animation', 'Comedy', 'Fantasy', 'Romance']","The third film finds Ataru transformed into a pink hippopotamus, which sends Lum chasing after the wicked magician responsible, with catastrophic results. With Lum gone, her friends decide that there is no reason to remain, and so Tomobiki slowly returns to normal. The highlight of the film is a high speed chase scene with an angry Lum flying after the mysterious Ruu through the city at night and into a hall of mirrors (and illusion ). Ataru's true feelings for Lum are probably more obvious in this film than any of the others.",$0.00,93,
6776,511617,ja,伯林漂流,13.011,9/10/2017,5.7,6,['Drama'],"Kôichi is a Japanese man living alone in Berlin. He has no job and hardly any friends. One night Kôichi meets Ryota at a bar which is also a sex club. Ryota came to Berlin to visit a German guy whom he had ""met"" on a dating app. His high hopes for romance (and marriage?) were quickly crushed since the German was only interested in sex, not even letting Ryota stay for the night. That is why Ryota ended up spending the night in the dark room of the sex club. Kôichi for some reason lets Ryota stay at his apartment. They have sex. Ryota goes out almost everyday to get laid by various local men and comes home to Kôichi's. Increasingly caught up with a strange feeling that is akin to but not quite frustration or curiosity (needless to say, it is not even close to love), Kôichi gradually gives himself up to sex with Ryota.",$0.00,123,
6792,212156,ja,劇場版 空の境界 未来福音 the Garden of sinners/recalled out summer,13.871,9/28/2013,7.2,35,"['Animation', 'Science Fiction']","Mirai Fukuin (lit. The Future's Gospel) is a side story of Kara no Kyoukai novel series. It is divided into two parts, Möbius ring, and Möbius Link.",$0.00,89,
6870,184608,ja,聖☆おにいさん,11.649,5/9/2013,7.8,45,"['Animation', 'Comedy']","Jesus Christ and Gautama Buddha, the founders of Christianity and Buddhism, are living together as roommates in a Tokyo apartment while taking a vacation on Earth. The comedy often involves jokes about Christianity, Buddhism, and all things related, as well as the main characters' attempts to hide their identities and understand modern society in Japan.",$0.00,90,
6884,100271,ja,ももへの手紙,12.793,4/21/2012,7.5,263,"['Comedy', 'Fantasy', 'Animation', 'Drama', 'Family']","Clinging to an unfinished letter written by her recently deceased father, young Momo moves with her mother from bustling Tokyo to the remote Japanese island of Shio. Upon their arrival, she begins to explore her new habitat, meeting local children and learning their routines and customs. However, it's not long before several bizarre occurrences crop up around the previously tranquil island. Orchards are found ransacked, prized trinkets start disappearing and, worst of all, each morning after her mother leaves for work, Momo hears strange mumblings coming from the attic of their home. Annoyed by these creepy goings-on and her mother's refusal to believe them, Momo embarks on a strange and supernatural adventure to discover the source of the mischief, which leads her to a trio of troublesome imps: the flatulent lizard Kawa, the childlike Mame and their hulking ogre leader Iwa. Momo also learns that her visit to the island is in some way connected to her father's mysterious letter.","$6,748,712.00",120,
6885,39256,ja,Godzilla 1985,16.539,7/26/1985,6.7,122,"['Action', 'Science Fiction', 'Thriller']","Originally released in Japan as ""The Return of Godzilla""  in 1984, this is the heavily re-edited, re-titled ""Godzilla 1985"".  Adding in new footage of Raymond Burr, this 16th Godzilla film ignores all previous sequels and serves as a direct follow-up to the 1956 ""Godzilla King of the Monsters"", which also featured scenes with Burr edited into 1954's ""Godzilla"". This film restores the darker tone of the original, as we witness the nuclear destruction of giant lizard terrorizing Japan.","$4,116,395.00",87,Prepare yourself: the greatest star of all has returned.
6887,21057,ja,海がきこえる,12.789,5/5/1993,6.3,564,"['Romance', 'Animation', 'Drama', 'TV Movie']","At Kichijōji Station, Tokyo, Taku Morisaki glimpses a familiar woman on the platform opposite boarding a train. Later, her photo falls from a shelf as he exits his apartment before flying to Kōchi Prefecture. Picking it up, he looks at it briefly before leaving. As the aeroplane takes off he narrates the events that brought her into his life...",$0.00,72,
6905,12140,ja,イノセンス,15.533,3/6/2004,7.3,588,"['Animation', 'Drama', 'Science Fiction']",Groundbreaking director Mamoru Oshii continues to push the boundaries of art and anime with this universally acclaimed cyber thriller following cyborg detective Batou as he tries to unravel the reasons for a murderous robot revolt in the year 2032. A quest for a killer that becomes a mind bending search for the meaning of life.,"$9,789,651.00",100,"When machines learn to feel, who decides what is human..."
6931,20921,ja,キューティーハニー,15.375,5/29/2004,6.5,45,['Action'],"When Honey's uncle gets kidnapped by the evil criminal gang known as ""Panther Claw,"" she must use her magical powers of transformation (fueled by love) to save him. Meanwhile the same crime group has been responsible for a number of other crime sprees across Tokyo. In the process, Honey teams up with the seemingly cold police woman Natsuko Aki and hot shot journalist Seiji Hayami as well as battle the four ""claws"" of the Panther Claw gang to save her uncle and the rest of the city.",$0.00,94,
6938,594188,ja,二ノ国,12.544,8/23/2019,6.7,178,"['Animation', 'Action', 'Adventure', 'Family', 'Fantasy', 'Romance']","Adapted from the video game series of the same name, NiNoKuni follows high school peers Yuu and Haru who must travel between two separate yet parallel worlds to help save their childhood friend, Kotona, whose life is in danger. In this magical quest complicated by love, the three teens will be tasked with making the ultimate choice.",$0.00,106,Choose your life
6959,729791,ja,美女奉行　おんな牢秘抄,11.516,3/24/1995,0,0,[],"A woman calling herself Princess Oryu enters the woman's prison. She is Kasumi, the daughter of the famous magistrate, Ooka Echizen, who slowly after hearing each of the prisoner's stories begins to realize the mystery that lies behind what it could be a big conspiracy.",$0.00,78,
6982,20722,ja,つみきのいえ,10.514,6/10/2008,8,342,"['Animation', 'Drama', 'Family']",La Maison en Petits Cubes tells the story of a grandfather's memories as he adds more blocks to his house to stem the flooding waters.,$0.00,12,
6999,592867,ja,ドラゴンクエスト ユア・ストーリー,10.777,8/2/2019,6.8,142,"['Animation', 'Adventure', 'Comedy', 'Fantasy', 'Action', 'Family']",Luca follows in his father's footsteps to rescue his mother from evil Ladja. Finding the heavenly hero who wields the Zenithian sword is his only hope.,$0.00,102,
7021,175168,ja,レイプゾンビ LUST OF THE DEAD,15.522,7/13/2012,6.1,94,"['Comedy', 'Horror']","After a nuclear attack in Tokyo, the female population is attacked by infected males who have become sex-crazed zombies, hungry for human flesh. Officeworker Momoko and nurse Nozomi seek shelter in a Shinto Shrine, where they meet housewife Kanae and school girl Tamae. With no choices left to them, the group of girls decides to take a stand and arm themselves with assault rifles and explosives to fight off hordes of horny zombies. What is the secret to killing the zombies for good?",$0.00,73,
7022,212153,ja,劇場版 ペルソナ3 第1章 Spring of Birth,13.813,11/23/2013,7.3,27,"['Animation', 'Action', 'Fantasy']","In the spring, male student Makoto Yuki transfers to Gekkoukan High School. However, as he heads to his new dormitory, listening to the music on his headphones, he is stopped. More precisely, time has stopped, and the people who were around him turn into coffins. Makoto learns that this period of time hidden between the minute of midnight is called the Dark Hour, a time when monsters called Shadows appear. Suddenly made the leader of his fellow classmates Yukari and Junpei by his upperclassmen Mitsuru and Akihiko, Makoto must learn empathy, his connection to his comrades, and the meaning of death. With the power of his Evoker aimed at his head, Makoto fights against the Shadows threatening to attack his world from the mysterious tower of Tartarus.",$0.00,92,The End of Everything Begins...
7041,71883,ja,レッドライン,11.747,5/27/2010,7.5,253,"['Animation', 'Action', 'Science Fiction']","The most dangerous and exciting car race in the universe is held only once every five years. And that's tonight. The competitors are lined up at the starting block. In his vehicle, JP, the most daredevil driver on the circuit, is ready for the green light. Female driver Sonoshee, with whom he is secretly in love, is also on the starting line. She will stop at nothing to get on to that podium. In this race, not only is anything possible, but also anything is allowed. In fact, their adversaries have modified their vehicles to equip them with highly destructive weapons; with such participants, it is hardly surprising that Redline is forbidden by the authorities, who will try anything to halt the proceedings.",$0.00,102,
7074,585077,ja,海獣の子供,15.504,6/7/2019,7.2,206,"['Animation', 'Fantasy', 'Adventure', 'Mystery']","Ruka is a young girl whose parents are separated and whose father works in an aquarium. When two boys, Umi and Sora, who were raised in the sea by dugongs, are brought to the aquarium, Ruka feels drawn to them and begins to realize that she has the same sort of supernatural connection to the ocean that they do. Umi and Sora's special power seems to be connected to strange events that have been occurring more and more frequently, such as the appearance of sea creatures far from their home territory and the disappearance of aquarium animals around the world. However, the exact nature of the boys' power and of the abnormal events is unknown, and Ruka gets drawn into investigating the mystery that surrounds her new friends.",$0.00,110,
7081,452214,ja,連続レイプ　変態実験,11.292,2/9/1990,4,2,[],"Tired of the belligerence and bad manners of a female customer, two shop owners kidnap her and subject her to a series of sexual assaults and tortures with utensils from the shop.",$0.00,60,
