sr_no,id,original_language,original_title,popularity,release_date,vote_average,vote_count,genre,overview,revenue,runtime,tagline
3661,9669,ja,リング 2,18.776,1/23/1999,5.8,268,"['Horror', 'Mystery', 'Science Fiction']","While investigating the horrifying death of her boyfriend, Mai Takano learns about a videotape haunted by the spirit of a disturbing girl named Sadako, which kills anyone who watches it exactly one week later. When her boyfriend’s son, Yoichi, starts to develop the same psychic abilities as Sadako, Takano must find a way to keep the boy and herself from becoming the next victims.","$18,686,644.00",92,
3678,333622,ja,劇場版 境界の彼方 -I'll Be Here- 未来篇,20.484,4/25/2015,7.5,57,"['Animation', 'Action', 'Fantasy', 'Drama', 'Comedy']","The battle is over, and they can go about their normal lives now... or so they thought. With no time to rejoice after miraculously saving Mirai from Beyond the Boundary, Mirai lost all her memories. Akihito, now a high school senior, starts to avoid Mirai thinking it’s for the better. Not aware of Akihito’s feelings, Mirai tries to get closer to Akihito. Then, someone who knows of Mirai appears in front of the two. With Akihito’s troubles in vain, Mirai once again sets forth on a battle that forces her to look within.",$0.00,90,
3679,559519,ja,えいがのおそ松さん,26.185,3/15/2019,8,5,"['Comedy', 'Animation']","The sextuplets attend a high school class reunion. There, they see all their former classmates who have become ""proper"" adults with company jobs.  The sextuplets sulk about this and go home and drink until they fall asleep. But when they wake up, a certain scene awaits them.",$0.00,108,
3683,10991,ja,劇場版ポケットモンスター 結晶塔の帝王 エンテイ,24.216,7/8/2000,6.4,459,"['Adventure', 'Fantasy', 'Animation', 'Action', 'Family']","When Me Snowdon's sadness of her father's disappearance get to her, she unknowingly uses the Unknown to create her own dream world along with Entei, who she believes to be her father. When Entei kidnaps Satoshi's mother, Satoshi along with Kasumi & Takeshi invade the mansion looking for his mom and trying to stop the mysteries of Me's Dream World and Entei!","$68,411,275.00",93,This Spring the Unown Spells Adventure
3735,494471,ja,劇場版 のんのんびより ばけーしょん,20.105,8/25/2018,6.5,12,"['Comedy', 'Animation', 'Adventure', 'Drama']","The movie for Non Non Biyori series.
 Summer vacation is drawing to an end. When Suguru wins a free trip to Okinawa, all of the five students of Asahigaoka branch school are excited to end their vacation with a bang. Along with Hikage, Konomi, and their teacher and the candy store owner, everyone goes to Okinawa for a fun three-day trip. There, Natsumi makes friends with Aoi, the girl who helps out at the hotel they stay in.",$0.00,71,
3767,3176,ja,バトル・ロワイアル,18.966,12/16/2000,7.3,2496,"['Drama', 'Thriller', 'Action']","In the future, the Japanese government captures a class of ninth-grade students and forces them to kill each other under the revolutionary ""Battle Royale"" act.","$25,000,000.00",123,Could you kill your best friend?
3776,221732,ja,るろうに剣心　伝説の最期編,19.21,9/13/2014,7.8,304,"['Action', 'Adventure', 'Drama', 'Fantasy']","Shishio has set sail in his ironclad ship to bring down the Meiji government and return Japan to chaos, carrying Kaoru with him. In order to stop him in time, Kenshin trains with his old master to learn his final technique.",$0.00,135,
3781,10228,ja,劇場版ポケットモンスター ミュウツーの逆襲,21.453,7/18/1998,6.9,1088,"['Animation', 'Family', 'Adventure', 'Fantasy', 'Action']","The adventure explodes into action with the debut of Mewtwo, a bio-engineered Pokémon created from the DNA of Mew, the rarest of all Pokémon. Determined to prove its superiority, Mewtwo lures Satoshi, Pikachu and others into a Pokémon match like none before. Mewtwo vs. Mew. Super-clones vs. Pokémon. It's the ultimate showdown ... with the very future of the world at stake!","$163,644,662.00",85,The Pokémon Match of All Time is Here.
3790,401917,ja,黒崎くんの言いなりになんてならない,23.846,2/2/2016,7.6,63,"['Comedy', 'Romance']","Yu Akahane (Nana Komatsu) moves to a dormitory room after her father's transfer from work. She is excited that she will live in the same dorm as Takumi Shirakawa (Yudai Chiba) aka ""White Prince."" Yet, Haruto Kurosaki (Kento Nakajima) aka ""Black Devil"" kisses her as punishment for going against him. It is Yu Akahane’s first kiss. Since then, she becomes obedient to Haruto Kurosaki.",$0.00,93,
3827,438640,ja,きょうのキラ君,28.92,2/25/2017,7.9,58,"['Romance', 'Drama']","Nino is a quiet outcast with only a bird for a friend. Kira is a popular boy with a big secret. Even though they live next to each other, they have never spoken. But when Nino learns Kira's secret, everything begins to change, and what starts as a hesitant friendship grows into something more… but how long can it last?",$0.00,109,
3836,420426,ja,Bleach,22.427,7/20/2018,6.6,423,"['Action', 'Fantasy', 'Adventure']","High school student Ichigo Kurosaki lives an ordinary life, besides being able to see ghosts and the blurry memories of his mother death under strange circumstances when he was a kid. His peaceful world suddenly breaks as he meets Rukia Kuchiki, a God of Death.","$4,001,919.00",108,The Soul Reaper Agent Arc
3849,44729,ja,ワンピース the movie オマツリ男爵と秘密の島,23.658,3/5/2005,7.1,136,"['Action', 'Animation', 'Comedy']","The Straw Hats visit a recreational island, run by Baron Omatsuri, the former captain of a pirate crew, who were all killed years ago. Being the only survivor, he then started hating all close-knit groups of pirates and wishing to separate them. He and his henchmen seed distrust among the Straw Hats and capture them one by one, leaving only Luffy to free his crew from the Baron's hold.","$10,494,545.00",92,
3882,16221,ja,どろろ,18.955,3/15/2007,7,94,"['Action', 'Fantasy', 'Horror', 'Science Fiction']","Hyakkimaru, a warrior on a quest to reclaim 48 of his body parts which were each taken by a demon, is joined by Dororo, a thief on a quest to avenge the death of her parents.",$0.00,139,"Fueled by hate, entwined by fate... their paths begin to unravel."
3900,44730,ja,ワンピース カラクリ城のメカ巨兵,19.868,3/4/2006,7.1,102,"['Action', 'Animation', 'Comedy']","The Straw Hats visits an island, known as Mecha Island, where a fisherman sings an old folk song about a Golden Crown. Searching for that mysterious treasure, they find a hidden entrance into the island. The island's leader, Ratchet, impressed with the find and in search of the Golden Crown himself, invites the crew to join him in his search and the crew along with Ratchet and his henchmen enter the cave. As it turns out, the islands true form, is that of a giant turtle. Ratchet, who had known this all along, uses his mechanical castle to take control of the turtle, in order to use it, to take over the world. Now the Straw Hats have to stop not only Ratchet, but also the helpless turtle, from crashing into a nearby island.","$7,232,965.00",94,
3912,539073,ja,3D彼女 リアルガール,23.557,6/18/2018,6.3,6,['Romance'],"Hikaru Tsutsui is a high school student. He enjoys animation and video games in the virtual world, but he doesn't enjoy his real life. People at his school don't even know he exists. One day, he cleans up the pool at his school with beautiful Iroha Ikarashi. Iroha approaches Hikaru and confesses that she likes him.",$0.00,114,
3940,114372,ja,真救世主伝説 北斗の拳 ラオウ伝 激闘の章,24.396,4/28/2007,6.3,35,"['Action', 'Animation']","A film adaptation of the Last Nanto General story arc from the manga, depicting the final battle between Kenshiro and Raoh that led to Kenshiro becoming the successor of Hokuto Shinken. Some events from the manga / anime have been excluded from the story (such as Raoh's fight with Juza) whereas others have been altered or expanded. New content featuring the final battle from Raoh's perspective have been added. This film serves as the follow-up to the first film in the series, which introduced Raoh and Reina's relationship, this time bringing it to a conclusion.",$0.00,95,
3941,10494,ja,パーフェクトブルー,17.095,7/25/1997,8.3,1460,"['Animation', 'Thriller']",A retired pop singer turned actress' sense of reality is shaken when she is stalked by an obsessed fan and seemingly a ghost of her past.,"$112,536.00",81,The color of illusion is Perfect Blue.
3962,9696,ja,殺し屋1,19.277,12/22/2001,7.1,639,"['Action', 'Crime', 'Horror']","As sadomasochistic yakuza enforcer Kakihara searches for his missing boss he comes across Ichi, a repressed and psychotic killer who may be able to inflict levels of pain that Kakihara has only dreamed of.",$0.00,129,Love really hurts
4055,46304,ja,Fate/stay night UNLIMITED BLADE WORKS,20.907,1/23/2010,7,38,"['Action', 'Fantasy', 'Animation']","Shirou Emiya finds himself an unwilling participant in a deadly competition where seven Mages summon heroic spirits as servants to duel each other to the death. They compete for the chance to make a wish from the Holy Grail, which has the power to grant any wish. Shirou is unskilled as a mage and knows nothing of the Holy Grail War, but he and his servant, Saber, enter into a temporary partnership with another Mage, Rin Tohsaka. However, problems arise between Shirou and Rin's servant, Archer, who seems to seriously despise him.",$0.00,107,
4090,240341,ja,攻殻機動隊ARISE border: 3 Ghost Tears,23.743,6/28/2014,6.8,106,"['Action', 'Animation', 'Science Fiction']","Posing as lovers on vacation, Motoko and Batou work to try to stop a terrorist organization whose symbol is the Scrasath. Meanwhile, Togusa investigates a murder of a man who possessed a prosthetic leg manufactured by the Mermaid's Leg corporation.",$0.00,59,
4095,880050,ja,劇場版 七つの大罪 光に呪われし者たち,19.687,7/2/2021,6,2,['Animation'],,$0.00,0,
4108,430447,ja,メアリと魔女の花,23.636,7/8/2017,7.1,585,"['Fantasy', 'Adventure', 'Animation']","Mary Smith, a young girl who lives with her great-aunt in the countryside, follows a mysterious cat into the nearby forest where she finds a strange flower and an old broom, none of which is as ordinary as it seems.",$0.00,103,
4138,39144,ja,ドラゴンボール 神龍の伝説,20.956,12/20/1986,6.8,211,"['Action', 'Animation', 'Adventure', 'Comedy', 'Fantasy', 'Science Fiction']",The great King Gurumes is searching for the Dragon Balls in order to put a stop to his endless hunger. A young girl named Pansy who lives in the nearby village has had enough of the treachery and decides to seek Muten Rōshi for assistance. Can our heroes save the village and put a stop to the Gurumes Army?,$0.00,50,
4139,15999,ja,吸血鬼ハンターD ブラッドラスト,22.907,8/25/2000,7.6,372,"['Animation', 'Fantasy', 'Horror', 'Action']","D has been hired to track down Meier Link, a notoriously powerful vampire who has abducted a woman, Charlotte Elbourne. D's orders are strict - find Charlotte, at any cost. For the first time, D faces serious competition. The Markus Brothers, a family of Vampire Hunters, were hired for the same bounty. D Must intercept Meier and conquer hostile forces on all sides in a deadly race against time.","$151,086.00",103,
4143,245917,ja,銀魂 完結篇 万事屋よ永遠なれ,21.79,7/4/2013,8,71,"['Action', 'Comedy', 'Science Fiction', 'Animation']","What would have happened if the Shiroyasha never existed?  Edo is thrown to chaos by a mysterious cause. Sakata Gintoki, now lives in a world where the future has changed, without him. What has happened to the Yorozuya?  Gintoki, who is now a ghost of the past, must once again carry the burden in order to save his friends. He must finish the biggest job ever, which may be the final job of Yorozuya.",$0.00,110,
4152,196761,ja,ハル,21.614,6/8/2013,6.8,72,"['Animation', 'Romance']","Kurumi’s heart was broken by the sudden death of her boyfriend in a tragic airplane accident. By melding futuristic technology with the binary equivalent of human emotion, a brilliant scientist created an ultra-lifelike robotic surrogate to take Hal’s place – and lure Kurumi from her shroud of solitude.",$0.00,60,
4195,129743,ja,アナザー,19.508,8/4/2012,6.1,36,"['Horror', 'Thriller', 'Mystery']","After a chain of deaths at a junior high school, new transfer student Koichi Sakakibara turns to a mysterious girl who holds the key to the dark mystery.",$0.00,109,
4212,505192,ja,万引き家族,17.376,6/2/2018,7.9,1430,['Drama'],"After one of their shoplifting sessions, Osamu and his son come across a little girl in the freezing cold. At first reluctant to shelter the girl, Osamu’s wife agrees to take care of her after learning of the hardships she faces. Although the family is poor, barely making enough money to survive through petty crime, they seem to live happily together until an unforeseen incident reveals hidden secrets, testing the bonds that unite them.",$0.00,121,
4225,15137,ja,ヱヴァンゲリヲン新劇場版：序,21.407,9/1/2007,7.7,555,"['Animation', 'Science Fiction', 'Action', 'Drama']","After the Second Impact, Tokyo-3 is being attacked by giant monsters called Angels that seek to eradicate humankind. The child Shinji's objective is to fight the Angels by piloting one of the mysterious Evangelion mecha units. A remake of the first six episodes of GAINAX's famous 1996 anime series. The film was retitled ""Evangelion: 1.01"" for its home video version and ""Evangelion: 1.11"" for a release with additional scenes.","$20,000,000.00",101,
4230,11645,ja,乱,19.15,6/1/1985,8.1,1026,"['Action', 'Drama', 'History']","With Ran, legendary director Akira Kurosawa reimagines Shakespeare's King Lear as a singular historical epic set in sixteenth-century Japan. Majestic in scope, the film is Kurosawa's late-life masterpiece, a profound examination of the folly of war and the crumbling of one family under the weight of betrayal, greed, and the insatiable thirst for power.","$11,859,533.00",160,The Greatest Shakespeare Film.
4245,27812,ja,カクレンボ,17.636,3/3/2005,5.9,33,"['Animation', 'Horror']","Among the ruins of the city, there is a game only children can play. It is called “Otokoyo”; a game of hide-and-seek. But whenever children play this game, one by one they would disappear into the blinds of the buildings… The story begins when a boy enters the world of Otokoyo, to find his missing sister.",$0.00,25,
4251,39148,ja,ドラゴンボール 最強への道,21.893,3/2/1996,7.2,224,"['Animation', 'Adventure', 'Fantasy']","A retelling of Dragon Ball's origin with a different take on the meeting of Goku, Bulma, and Kame-Sen'nin. It also retells the Red Ribbon Army story; but this time they find Goku rather than Goku finding them.",$0.00,80,
4255,42360,ja,犬夜叉 時代を越える想い,16.892,12/15/2001,7.8,122,"['Action', 'Animation', 'Adventure', 'Fantasy']","InuYasha is a half-demon who was trapped in the Legendary Tree and was set free by Kagome, a girl who traveled 500 years through time. This time, both of them will have to face Menomaru, a Chinese demon whose father, known as Hyoga, came 300 years ago to invade Japan, but was stopped by InuYasha's Father. InuYasha and Kagome, along with Sango, Miroku, Shippou, Kaede and Myoga, will try to stop Menomaru in his becoming the most powerful demon ever.",$0.00,99,
4263,188403,ja,映画ドラえもん のび太のドラビアンナイト,15.495,3/9/1991,7,37,"['Animation', 'Adventure', 'Fantasy']","With Doraemon's ""Storybook Shoes"" gadget, he and Nobita go to different stories to watch them. Nobita asks Doraemon to allow him to share this gadget with Shizuka and Doraemon agrees.",$0.00,99,
4283,396263,ja,GANTZ:O,17.88,10/14/2016,7.3,503,"['Science Fiction', 'Action', 'Animation']","Somewhere in Tokyo, there is a room. In that room is a black sphere. Periodically, people who should otherwise have died are transferred to the room. There, the sphere gives them special suits and weapons, and sends them out on a mission to kill aliens here on Earth. While these missions take place, the rest of the world is largely oblivious to them. These missions are lethal - few participants survive them. The sphere calls the shots, and it's not the slightest bit nice. Its name... Gantz.","$2,238,600.00",95,
4300,874960,ja,Kimetsu Orchestra Concert,20.361,,0,0,['Music'],Tokyo Philharmonic Orchestra live Kimetsu no Yaiba concert,$0.00,114,Kimetsu no Yaiba concert
4311,747988,ja,君は永遠にそいつらより若い,22.457,9/17/2021,0,0,['Drama'],"Horigai spends her boring days waiting to graduate from college. As she hangs out with friends, she begins to realize the violence and sorrow behind their ordinary lives.",$0.00,118,
4322,296917,ja,劇場版 サイコパス,24.357,1/9/2015,7.1,149,"['Animation', 'Science Fiction', 'Action']","Year 2116—The Japanese government begins to export the Sibyl System unmanned drone robots to troubled countries, and the system spreads throughout the world. A state in the midst of a civil war, SEAUn (the South East Asia Union), brings in the Sibyl System as an experiment. Under the new system, the coastal town of Shambala Float achieves temporary peace and safety. But then SEAUn sends terrorists to Japan. They slip through the Sibyl System and then attack from within. The shadow of a certain man falls on this incident. In charge of the police, Tsunemori travels to Shambala Float to investigate. The truth of justice on this new ground will become clear.",$0.00,113,
4328,25961,ja,劇場版ポケットモンスター ダイヤモンド&パール ディアルガVSパルキアVSダークライ,18.849,7/14/2007,6.8,192,"['Family', 'Adventure', 'Animation', 'Fantasy', 'Action']","Ash and friends (this time accompanied by newcomer Dawn) arrive at an idyllic village on their way to their next Pokemon contest, where chaos will soon erupt with the prophecy of two Pokemon Gods (Dialga and Palkia) and the arrival of a mysterious, seemingly deadly Pokemon named Darkrai, which has the power to distort space and time.","$42,538,454.00",90,Somewhere Between Time & Space... A Legend Is Born.
4347,116776,ja,ドラゴンボール 魔訶不思議大冒険,20.086,7/9/1988,6.7,172,"['Action', 'Animation']","Master Roshi has succeeded at the one mission he valued most: to train Goku and Krillin to become ultimate fighters. So, he arranges for them to test their mettle at a competition hosted by Emperor Chiaotzu. Not everyone's playing by the rules, however, as a member of the ruler's household schemes to use the Dragonballs to extort money and power from the royal.",$0.00,48,
4354,169934,ja,アイアンマン：ライズ・オブ・テクノヴォア,18.586,4/24/2013,5.8,125,"['Science Fiction', 'Animation', 'Action']","Iron Man enlists the help of ruthless vigilante the Punisher to track down War Machine's murderer. All the while, he's being pursued by S.H.I.E.L.D. agents Black Widow and Hawkeye, who suspect his involvement in a recent terrorist plot.",$0.00,88,Can Iron Man save the world when the world is against him?
4385,79516,ja,鉄拳 ブラッド・ベンジェンス,21.068,7/26/2011,6.9,162,"['Action', 'Animation', 'Science Fiction']","Set in the rich Tekken universe, Tekken: Blood Vengeance 3D follows Xiaoyu Ling, seasoned martial artist and high school student, tasked by the G Corporation to infiltrate an international school in Kyoto to gather information on the mysterious student Shin Kamiya. Before she can make any progress in the investigation, Shin is kidnapped by an unknown assailant. Digging deeper into Shin’s background in an attempt to rescue him, Xiaoyu learns about the frightening underbelly of the Mishima Zaibatsu. Jin Kazama, Kazuya Mishima… and the late Heihachi Mishima’s conspiracy that’s stained with blood.",$0.00,100,
4396,334376,ja,攻殻機動隊 新劇場版,19.566,6/20/2015,6.7,124,"['Science Fiction', 'Animation']","When a ghost-infecting virus known as Fire-Starter begins spreading through the system resulting in the assassination of the Japanese Prime Minister, Major Motoko Kusanagi and her elite team of special operatives are called in to track down its source.","$101,203.00",100,
4432,346,ja,七人の侍,25.543,4/26/1954,8.5,2426,"['Action', 'Drama']","A samurai answers a village's request for protection after he falls on hard times. The town needs protection from bandits, so the samurai gathers six others to help him teach the people how to defend themselves, and the villagers provide the soldiers with food.","$271,842.00",207,The Mighty Warriors Who Became the Seven National Heroes of a Small Town
4474,728754,ja,STAND BY ME ドラえもん2,19.043,11/20/2020,7.8,66,['Animation'],"She and her beloved Shizuka are finally married! Nobita's childhood dream was supposed to come true on his wedding day, but for some reason, Nobita doesn't show up... One of the most popular episodes from the original story transcends time and space, and leads to Nobita's future. Doraemon and Nobita's great adventure begins in order to fulfill his grandmother's wish to see his bride at first sight. This is a story of tears and bonds, set in the past, present and future.",$0.00,96,
4477,290271,ja,ONE PIECE “3D2Y” エースの死を越えて! ルフィ仲間との誓い,16.826,12/31/2014,7.4,77,"['Action', 'Animation', 'Adventure', 'Comedy', 'Fantasy']","The special takes place during the two year before the Straw Hats reunite on Sabody.  Luffy is currently in Rusukaina training to get stronger to take on the New World. However the training  is interrupted when Hancock's sisters, Marigold and Sandersonia, are kidnapped by the Byrnndi World,  a pirate who was locked away on Level 6 of Impel Down but escaped during Luffy's invasion to save Ace,  in order to lure Hancock to him and use her as a hostage against the World Government due to her  Shichibukai status. Thus Luffy and Hancock head off to confront him and save Hancock's sisters.",$0.00,105,
4507,428125,ja,君と100回目の恋,13.529,2/4/2017,7.4,26,"['Romance', 'Drama']","On July 27th, university student Aoi Hinata (Miwa) has an accident. When she wakes up, Aoi Hinata finds herself in a classroom from one week before the accident.  At that time, her childhood friend Riku Hasegawa (Kentaro Sakaguchi) tells her ""I will tell you a secret. I can turn back time."" Aoi Hinata and Riku Hasegawa like each other, but never expressed their feelings. They share their feelings for each other and go back to one year earlier. They spend their time happily as girlfriend and boyfriend, but there is a big secret behind the time slip. In addition, July 27 is approaching.",$0.00,116,
4525,149871,ja,かぐや姫の物語,17.739,11/23/2013,8.1,1224,"['Animation', 'Drama', 'Fantasy']","Found inside a shining stalk of bamboo by an old bamboo cutter and his wife, a tiny girl grows rapidly into an exquisite young lady. The mysterious young princess enthrals all who encounter her. But, ultimately, she must confront her fate, the punishment for her crime.","$24,366,656.00",137,A princess's crime and punishment
4551,14092,ja,攻殻機動隊 2.0,18.971,7/12/2008,7.5,281,"['Action', 'Animation', 'Science Fiction']","In the year 2029, Section 9, a group of cybernetically enhanced cops, are called in to investigate and stop a highly-wanted hacker known as 'The Puppetmaster'.  Ghost in the Shell 2.0 is a reproduced version of its original 1995 counterpart. Among a numerous enhancements, for the film's 2.0 release, were a number of scenes were overhauled with 3D animation, visual improvements, and soundtrack rerecorded in 6.1 surround sound.",$0.00,85,It Found A Voice... Now It Needs A Body
4556,553610,ja,機動戦士ガンダムNT,20.443,11/30/2018,7.3,7,"['Animation', 'Science Fiction', 'Action']","U.C. 0097, one year after the opening of ""Laplace's Box"".  Despite the revelation of the Universal Century Charter that acknowledges the existence and rights of Newtypes, the framework of the world has not been greatly altered.  The conflict later dubbed the ""Laplace Incident"" is thought to have ended with the downfall of the Neo Zeon remnants known as the Sleeves. In its final battle, two full psycho-frame mobile suits displayed power beyond human understanding. The white unicorn and the black lion were sealed away to remove this danger from people's consciousness, and they should now be completely forgotten.  However, the RX-0 Unicorn Gundam 03, which disappeared two years earlier, is now about to show itself in the Earth Sphere once more. A golden phoenix… named Phenex.",$0.00,90,The Destination of the Newtype Myth.
4562,12599,ja,劇場版ポケットモンスター 幻のポケモン ルギア爆誕,23.414,7/17/1999,6.6,629,"['Adventure', 'Fantasy', 'Animation', 'Science Fiction', 'Family']","Satoshi must put his skill to the test when he attempts to save the world from destruction. The Greedy Pokemon collector Gelardan throws the universe into chaos after disrupting the balance of nature by capturing one of the Pokemon birds that rule the elements of fire, lightning and ice. Will Satoshi have what it takes to save the world?","$163,649,270.00",84,One Person Can Make All The Difference!
